sentence,homophone,condition,repeated,plural,target_token_surprisal,target_span_surprisal_sum,target_span_surprisal_mean,spillover_1_surprisal,spillover_2_surprisal,n_target_tokens,target_token_str,match_found,model,checkpoint,n_params
"Scott was a wrestler and a fighter when he was young, but being a boxer gave him arthritis.",boxer,dominant,no,no,11.92359733581543,23.89274311065674,11.94637155532837,10.478460311889648,11.686657905578613,2, boxer,True,EleutherAI/pythia-14m,8,14067712
"The builder was supposed to put in the new kitchen counter and cabinets, but the selected cabinet style was sold out.",cabinet,dominant,yes,yes,10.40502643585205,10.40502643585205,10.40502643585205,11.032840728759766,10.15244197845459,1, cabinet,True,EleutherAI/pythia-14m,8,14067712
"The builder was supposed to put in the new kitchen, but the selected cabinet style was sold out.",cabinet,dominant,no,yes,10.432136535644531,10.432136535644531,10.432136535644531,11.010504722595215,10.19028091430664,1, cabinet,True,EleutherAI/pythia-14m,8,14067712
"Mark's favorite band was playing in his town, but back stage passes to meet the band members were sold out.",band,dominant,yes,no,11.292716979980469,11.292716979980469,11.292716979980469,11.523991584777832,10.273058891296387,1, band,True,EleutherAI/pythia-14m,8,14067712
"Mark's favorite music group was playing in his town, but back stage passes to meet the band members were sold out.",band,dominant,no,no,11.13907241821289,11.13907241821289,11.13907241821289,11.383548736572266,10.382011413574219,1, band,True,EleutherAI/pythia-14m,8,14067712
"Maddy always paid attention and took notes, but when she was sick she had to get a copy of the notes from her friend.",notes,dominant,yes,yes,11.403791427612305,11.403791427612305,11.403791427612305,10.312858581542969,10.61440372467041,1, notes,True,EleutherAI/pythia-14m,8,14067712
"Maddy always paid attention and took notes, but when she was sick she had to get a copy of the notes from her friend.",notes,dominant,no,yes,11.403791427612305,11.403791427612305,11.403791427612305,10.312858581542969,10.61440372467041,1, notes,True,EleutherAI/pythia-14m,8,14067712
"Marge was responsible for finding a graduation speaker, so when the speaker canceled last minute she was fired.",speaker,dominant,yes,no,10.934256553649902,10.934256553649902,10.934256553649902,10.092815399169922,10.805646896362305,1, speaker,True,EleutherAI/pythia-14m,8,14067712
"Marge was responsible for organizing the graduation ceremony, so when the speaker canceled last minute she was fired.",speaker,dominant,no,no,11.066158294677734,11.066158294677734,11.066158294677734,10.281712532043457,10.634978294372559,1, speaker,True,EleutherAI/pythia-14m,8,14067712
"For class the kids had to write a poem or a legend, but everyone wrote a legend because it was easier.",legend,dominant,yes,no,11.144697189331055,11.144697189331055,11.144697189331055,10.905221939086914,10.772692680358887,1, legend,True,EleutherAI/pythia-14m,8,14067712
For class the kids had to write some kind of tall-tale; everyone wrote a legend because it was easier.,legend,dominant,no,no,11.497400283813477,11.497400283813477,11.497400283813477,10.941096305847168,10.84575080871582,1, legend,True,EleutherAI/pythia-14m,8,14067712
"At night Sue's mom reads her a story before bed, but last night they didn't read a story since she was in trouble.",story,dominant,yes,no,10.867635726928711,10.867635726928711,10.867635726928711,10.950994491577148,10.413521766662598,1, story,True,EleutherAI/pythia-14m,8,14067712
"At night Sue's mom reads her a book before bed, but last night they didn't read a story since she was in trouble.",story,dominant,no,no,10.91808795928955,10.91808795928955,10.91808795928955,11.001504898071289,10.388461112976074,1, story,True,EleutherAI/pythia-14m,8,14067712
"The students forgot to water the flowers and plant, so when they returned from break the plant was dead.",plant,dominant,yes,no,10.757253646850586,10.757253646850586,10.757253646850586,11.077808380126953,11.050273895263672,1, plant,True,EleutherAI/pythia-14m,8,14067712
"The students forgot to take care of the garden, so when they returned from break the plant was dead.",plant,dominant,no,no,11.089073181152344,11.089073181152344,11.089073181152344,11.59560775756836,11.065962791442871,1, plant,True,EleutherAI/pythia-14m,8,14067712
"The farmer grew potatoes and corn, but he only sold his corn at the local market.",corn,dominant,yes,no,11.906826972961426,11.906826972961426,11.906826972961426,10.42404556274414,10.63792610168457,1, corn,True,EleutherAI/pythia-14m,8,14067712
"The farmer grew many crops, but he only sold his corn at the local market.",corn,dominant,no,no,11.641117095947266,11.641117095947266,11.641117095947266,10.484376907348633,10.694040298461914,1, corn,True,EleutherAI/pythia-14m,8,14067712
Addictions and bad habits are hard to overcome because people often don't even realize what bad habit they have.,habit,dominant,yes,no,11.433355331420898,11.433355331420898,11.433355331420898,10.92569351196289,10.636283874511719,1, habit,True,EleutherAI/pythia-14m,8,14067712
Addictions and bad traits are hard to overcome because people often don't even realize what bad habit they have.,habit,dominant,no,no,11.203125,11.203125,11.203125,10.819398880004883,10.638834953308105,1, habit,True,EleutherAI/pythia-14m,8,14067712
"The costume looked good with a tiara or crown, but Pam bought a crown because it was really cheap.",crown,dominant,yes,no,12.297988891601562,12.297988891601562,12.297988891601562,10.37621021270752,10.702128410339355,1, crown,True,EleutherAI/pythia-14m,8,14067712
"The costume looked good with a tiara, but Pam bought a crown because it was really cheap.",crown,dominant,no,no,12.261201858520508,12.261201858520508,12.261201858520508,10.342144012451172,10.811935424804688,1, crown,True,EleutherAI/pythia-14m,8,14067712
"The saleswoman recommended that Gabe try a different suit, but he liked the suit he had on too much to listen.",suit,dominant,yes,no,11.816764831542969,11.816764831542969,11.816764831542969,11.56580924987793,10.85145378112793,1, suit,True,EleutherAI/pythia-14m,8,14067712
"The saleswoman recommended that Gabe try something different, but he liked the suit he had on too much to listen.",suit,dominant,no,no,11.781709671020508,11.781709671020508,11.781709671020508,11.582655906677246,10.913792610168457,1, suit,True,EleutherAI/pythia-14m,8,14067712
"Kristen put her spring coat on, but she changed into her winter coat after she felt how cold it was.",coat,dominant,yes,no,11.231210708618164,11.231210708618164,11.231210708618164,11.013744354248047,10.797799110412598,1, coat,True,EleutherAI/pythia-14m,8,14067712
"Kristen put her spring jacket on, but she changed into her winter coat after she felt how cold it was.",coat,dominant,no,no,11.389431953430176,11.389431953430176,11.389431953430176,10.964164733886719,10.78404426574707,1, coat,True,EleutherAI/pythia-14m,8,14067712
"Cal hoped to see the moon and stars with his telescope, but he couldn't see the stars because of the city lights.",stars,dominant,yes,yes,11.363045692443848,11.363045692443848,11.363045692443848,12.113377571105957,10.655158042907715,1, stars,True,EleutherAI/pythia-14m,8,14067712
"Cal hoped to see something with his telescope, but he couldn't see the stars because of the city lights.",stars,dominant,no,yes,11.494208335876465,11.494208335876465,11.494208335876465,11.977110862731934,10.676034927368164,1, stars,True,EleutherAI/pythia-14m,8,14067712
"Joyce's breakfast was supposed to come with toast, but she substituted potatoes for the toast because of her diet.",toast,dominant,yes,no,10.720969200134277,10.720969200134277,10.720969200134277,11.063390731811523,10.617201805114746,1, toast,True,EleutherAI/pythia-14m,8,14067712
"Joyce's breakfast was supposed to come with bread, but she substituted potatoes for the toast because of her diet.",toast,dominant,no,no,10.707743644714355,10.707743644714355,10.707743644714355,11.074216842651367,10.713214874267578,1, toast,True,EleutherAI/pythia-14m,8,14067712
"Roger rewired the light and changed the bulb, but it still didn't turn on because the bulb he used was wrong.",bulb,dominant,yes,no,9.888842582702637,9.888842582702637,9.888842582702637,11.573127746582031,10.755892753601074,1, bulb,True,EleutherAI/pythia-14m,8,14067712
"Roger rewired the light, but it still didn't turn on because the bulb he used was wrong.",bulb,dominant,no,no,9.957361221313477,9.957361221313477,9.957361221313477,11.503381729125977,10.851327896118164,1, bulb,True,EleutherAI/pythia-14m,8,14067712
"Although the managers and staff were worried about potential job cuts, it turned out that none of the staff were let go.",staff,dominant,yes,no,10.134073257446289,10.134073257446289,10.134073257446289,11.118218421936035,11.300749778747559,1, staff,True,EleutherAI/pythia-14m,8,14067712
"Although the managers were worried about potential job cuts, it turned out that none of the staff were let go.",staff,dominant,no,no,9.99559497833252,9.99559497833252,9.99559497833252,11.129934310913086,11.295700073242188,1, staff,True,EleutherAI/pythia-14m,8,14067712
The patio had one very comfortable chair that Christa wanted because the only other chair was old and broken.,chair,dominant,yes,no,12.005525588989258,12.005525588989258,12.005525588989258,11.846087455749512,12.102317810058594,1, chair,True,EleutherAI/pythia-14m,8,14067712
The patio had one very comfortable seat that Christa wanted because the only other chair was old and broken.,chair,dominant,no,no,12.014312744140625,12.014312744140625,12.014312744140625,12.088417053222656,12.042491912841797,1, chair,True,EleutherAI/pythia-14m,8,14067712
