sentence,homophone,condition,repeated,plural,target_token_surprisal,target_span_surprisal_sum,target_span_surprisal_mean,spillover_1_surprisal,spillover_2_surprisal,n_target_tokens,target_token_str,match_found,model,checkpoint,n_params
"Scott was a wrestler and a boxer when he was young, but being a boxer gave him arthritis.",boxer,dominant,yes,no,11.894209861755371,23.272912979125977,11.636456489562988,10.781515121459961,9.873366355895996,2, boxer,True,EleutherAI/pythia-160m,0,162322944
"Scott was a wrestler and a fighter when he was young, but being a boxer gave him arthritis.",boxer,dominant,no,no,11.889095306396484,23.266462326049805,11.633231163024902,10.676193237304688,10.061769485473633,2, boxer,True,EleutherAI/pythia-160m,0,162322944
"The builder was supposed to put in the new kitchen counter and cabinets, but the selected cabinet style was sold out.",cabinet,dominant,yes,yes,11.308012008666992,11.308012008666992,11.308012008666992,10.302178382873535,11.459667205810547,1, cabinet,True,EleutherAI/pythia-160m,0,162322944
"The builder was supposed to put in the new kitchen, but the selected cabinet style was sold out.",cabinet,dominant,no,yes,11.159785270690918,11.159785270690918,11.159785270690918,10.233742713928223,11.443885803222656,1, cabinet,True,EleutherAI/pythia-160m,0,162322944
"Mark's favorite band was playing in his town, but back stage passes to meet the band members were sold out.",band,dominant,yes,no,11.526911735534668,11.526911735534668,11.526911735534668,10.578454971313477,10.225099563598633,1, band,True,EleutherAI/pythia-160m,0,162322944
"Mark's favorite music group was playing in his town, but back stage passes to meet the band members were sold out.",band,dominant,no,no,11.466422080993652,11.466422080993652,11.466422080993652,10.532114028930664,10.189505577087402,1, band,True,EleutherAI/pythia-160m,0,162322944
"Maddy always paid attention and took notes, but when she was sick she had to get a copy of the notes from her friend.",notes,dominant,yes,yes,11.315404891967773,11.315404891967773,11.315404891967773,11.007026672363281,11.462775230407715,1, notes,True,EleutherAI/pythia-160m,0,162322944
"Maddy always paid attention and took notes, but when she was sick she had to get a copy of the notes from her friend.",notes,dominant,no,yes,11.315404891967773,11.315404891967773,11.315404891967773,11.007026672363281,11.462775230407715,1, notes,True,EleutherAI/pythia-160m,0,162322944
"Marge was responsible for finding a graduation speaker, so when the speaker canceled last minute she was fired.",speaker,dominant,yes,no,12.4843168258667,12.4843168258667,12.4843168258667,9.917049407958984,11.425107955932617,1, speaker,True,EleutherAI/pythia-160m,0,162322944
"Marge was responsible for organizing the graduation ceremony, so when the speaker canceled last minute she was fired.",speaker,dominant,no,no,12.615930557250977,12.615930557250977,12.615930557250977,9.890297889709473,11.340900421142578,1, speaker,True,EleutherAI/pythia-160m,0,162322944
"For class the kids had to write a poem or a legend, but everyone wrote a legend because it was easier.",legend,dominant,yes,no,12.3086519241333,12.3086519241333,12.3086519241333,11.624521255493164,11.30113697052002,1, legend,True,EleutherAI/pythia-160m,0,162322944
For class the kids had to write some kind of tall-tale; everyone wrote a legend because it was easier.,legend,dominant,no,no,12.203145980834961,12.203145980834961,12.203145980834961,11.832199096679688,11.171191215515137,1, legend,True,EleutherAI/pythia-160m,0,162322944
"At night Sue's mom reads her a story before bed, but last night they didn't read a story since she was in trouble.",story,dominant,yes,no,11.292750358581543,11.292750358581543,11.292750358581543,11.384014129638672,10.343036651611328,1, story,True,EleutherAI/pythia-160m,0,162322944
"At night Sue's mom reads her a book before bed, but last night they didn't read a story since she was in trouble.",story,dominant,no,no,11.32929801940918,11.32929801940918,11.32929801940918,11.491905212402344,10.253644943237305,1, story,True,EleutherAI/pythia-160m,0,162322944
"The students forgot to water the flowers and plant, so when they returned from break the plant was dead.",plant,dominant,yes,no,10.985929489135742,10.985929489135742,10.985929489135742,11.142416000366211,11.633079528808594,1, plant,True,EleutherAI/pythia-160m,0,162322944
"The students forgot to take care of the garden, so when they returned from break the plant was dead.",plant,dominant,no,no,11.00029182434082,11.00029182434082,11.00029182434082,11.012001037597656,11.59506607055664,1, plant,True,EleutherAI/pythia-160m,0,162322944
"The farmer grew potatoes and corn, but he only sold his corn at the local market.",corn,dominant,yes,no,10.01806640625,10.01806640625,10.01806640625,10.325593948364258,10.921130180358887,1, corn,True,EleutherAI/pythia-160m,0,162322944
"The farmer grew many crops, but he only sold his corn at the local market.",corn,dominant,no,no,10.026531219482422,10.026531219482422,10.026531219482422,10.559621810913086,11.320292472839355,1, corn,True,EleutherAI/pythia-160m,0,162322944
Addictions and bad habits are hard to overcome because people often don't even realize what bad habit they have.,habit,dominant,yes,no,11.104375839233398,11.104375839233398,11.104375839233398,11.545814514160156,10.73026180267334,1, habit,True,EleutherAI/pythia-160m,0,162322944
Addictions and bad traits are hard to overcome because people often don't even realize what bad habit they have.,habit,dominant,no,no,11.217888832092285,11.217888832092285,11.217888832092285,11.653603553771973,10.648346900939941,1, habit,True,EleutherAI/pythia-160m,0,162322944
"The costume looked good with a tiara or crown, but Pam bought a crown because it was really cheap.",crown,dominant,yes,no,10.694348335266113,10.694348335266113,10.694348335266113,11.135730743408203,11.137142181396484,1, crown,True,EleutherAI/pythia-160m,0,162322944
"The costume looked good with a tiara, but Pam bought a crown because it was really cheap.",crown,dominant,no,no,10.715935707092285,10.715935707092285,10.715935707092285,11.189311981201172,11.119462966918945,1, crown,True,EleutherAI/pythia-160m,0,162322944
"The saleswoman recommended that Gabe try a different suit, but he liked the suit he had on too much to listen.",suit,dominant,yes,no,10.669807434082031,10.669807434082031,10.669807434082031,11.039775848388672,12.232810020446777,1, suit,True,EleutherAI/pythia-160m,0,162322944
"The saleswoman recommended that Gabe try something different, but he liked the suit he had on too much to listen.",suit,dominant,no,no,10.642342567443848,10.642342567443848,10.642342567443848,10.998476028442383,12.214953422546387,1, suit,True,EleutherAI/pythia-160m,0,162322944
"Kristen put her spring coat on, but she changed into her winter coat after she felt how cold it was.",coat,dominant,yes,no,11.960103988647461,11.960103988647461,11.960103988647461,11.377653121948242,9.33168888092041,1, coat,True,EleutherAI/pythia-160m,0,162322944
"Kristen put her spring jacket on, but she changed into her winter coat after she felt how cold it was.",coat,dominant,no,no,11.956098556518555,11.956098556518555,11.956098556518555,11.438919067382812,9.193086624145508,1, coat,True,EleutherAI/pythia-160m,0,162322944
"Cal hoped to see the moon and stars with his telescope, but he couldn't see the stars because of the city lights.",stars,dominant,yes,yes,10.750663757324219,10.750663757324219,10.750663757324219,11.47568130493164,11.194007873535156,1, stars,True,EleutherAI/pythia-160m,0,162322944
"Cal hoped to see something with his telescope, but he couldn't see the stars because of the city lights.",stars,dominant,no,yes,10.703412055969238,10.703412055969238,10.703412055969238,11.538996696472168,11.26105785369873,1, stars,True,EleutherAI/pythia-160m,0,162322944
"Joyce's breakfast was supposed to come with toast, but she substituted potatoes for the toast because of her diet.",toast,dominant,yes,no,11.123538970947266,11.123538970947266,11.123538970947266,11.095938682556152,11.362717628479004,1, toast,True,EleutherAI/pythia-160m,0,162322944
"Joyce's breakfast was supposed to come with bread, but she substituted potatoes for the toast because of her diet.",toast,dominant,no,no,11.1821870803833,11.1821870803833,11.1821870803833,11.087142944335938,11.353656768798828,1, toast,True,EleutherAI/pythia-160m,0,162322944
"Roger rewired the light and changed the bulb, but it still didn't turn on because the bulb he used was wrong.",bulb,dominant,yes,no,11.447945594787598,11.447945594787598,11.447945594787598,10.241920471191406,11.011554718017578,1, bulb,True,EleutherAI/pythia-160m,0,162322944
"Roger rewired the light, but it still didn't turn on because the bulb he used was wrong.",bulb,dominant,no,no,11.482882499694824,11.482882499694824,11.482882499694824,10.107172012329102,11.253131866455078,1, bulb,True,EleutherAI/pythia-160m,0,162322944
"Although the managers and staff were worried about potential job cuts, it turned out that none of the staff were let go.",staff,dominant,yes,no,11.78781795501709,11.78781795501709,11.78781795501709,10.057703018188477,10.12621021270752,1, staff,True,EleutherAI/pythia-160m,0,162322944
"Although the managers were worried about potential job cuts, it turned out that none of the staff were let go.",staff,dominant,no,no,11.698493957519531,11.698493957519531,11.698493957519531,10.057855606079102,10.106531143188477,1, staff,True,EleutherAI/pythia-160m,0,162322944
The patio had one very comfortable chair that Christa wanted because the only other chair was old and broken.,chair,dominant,yes,no,12.472282409667969,12.472282409667969,12.472282409667969,9.958761215209961,9.248186111450195,1, chair,True,EleutherAI/pythia-160m,0,162322944
The patio had one very comfortable seat that Christa wanted because the only other chair was old and broken.,chair,dominant,no,no,12.435808181762695,12.435808181762695,12.435808181762695,9.955068588256836,9.29061508178711,1, chair,True,EleutherAI/pythia-160m,0,162322944
