sentence,homophone,condition,repeated,plural,target_token_surprisal,target_span_surprisal_sum,target_span_surprisal_mean,spillover_1_surprisal,spillover_2_surprisal,n_target_tokens,target_token_str,match_found,model,checkpoint,n_params
"The teens knew how to play a few card games, but they decided to play poker because they wanted to win money.",poker,dominant,no,no,3.0732126235961914,3.0732126235961914,3.0732126235961914,3.6772165298461914,1.0218400955200195,1, poker,True,EleutherAI/pythia-410m,128000,405334016
"Scott was a wrestler and a boxer when he was young, but being a boxer gave him arthritis.",boxer,dominant,yes,no,0.0015698263887315989,2.7625845263246447,1.3812922631623223,4.047595500946045,0.1077018529176712,2, boxer,True,EleutherAI/pythia-410m,128000,405334016
"Scott was a wrestler and a fighter when he was young, but being a boxer gave him arthritis.",boxer,dominant,no,no,0.007426985073834658,5.5320260603912175,2.7660130301956087,4.315662384033203,0.08728903532028198,2, boxer,True,EleutherAI/pythia-410m,128000,405334016
"The builder was supposed to put in the new kitchen counter and cabinets, but the selected cabinet style was sold out.",cabinet,dominant,yes,yes,5.283138275146484,5.283138275146484,5.283138275146484,7.309661865234375,1.332607388496399,1, cabinet,True,EleutherAI/pythia-410m,128000,405334016
"The builder was supposed to put in the new kitchen, but the selected cabinet style was sold out.",cabinet,dominant,no,yes,6.450789928436279,6.450789928436279,6.450789928436279,7.675971508026123,1.3771605491638184,1, cabinet,True,EleutherAI/pythia-410m,128000,405334016
"Mark's favorite band was playing in his town, but back stage passes to meet the band members were sold out.",band,dominant,yes,no,0.9100625514984131,0.9100625514984131,0.9100625514984131,5.001148223876953,0.8524138331413269,1, band,True,EleutherAI/pythia-410m,128000,405334016
"Mark's favorite music group was playing in his town, but back stage passes to meet the band members were sold out.",band,dominant,no,no,1.2599005699157715,1.2599005699157715,1.2599005699157715,4.082820892333984,0.8261440992355347,1, band,True,EleutherAI/pythia-410m,128000,405334016
"Maddy always paid attention and took notes, but when she was sick she had to get a copy of the notes from her friend.",notes,dominant,yes,yes,2.4271788597106934,2.4271788597106934,2.4271788597106934,2.3792150020599365,2.3328614234924316,1, notes,True,EleutherAI/pythia-410m,128000,405334016
"Maddy always paid attention and took notes, but when she was sick she had to get a copy of the notes from her friend.",notes,dominant,no,yes,2.4271788597106934,2.4271788597106934,2.4271788597106934,2.3792150020599365,2.3328614234924316,1, notes,True,EleutherAI/pythia-410m,128000,405334016
"Marge was responsible for finding a graduation speaker, so when the speaker canceled last minute she was fired.",speaker,dominant,yes,no,3.5587215423583984,3.5587215423583984,3.5587215423583984,7.68479061126709,5.273772239685059,1, speaker,True,EleutherAI/pythia-410m,128000,405334016
"Marge was responsible for organizing the graduation ceremony, so when the speaker canceled last minute she was fired.",speaker,dominant,no,no,6.417328834533691,6.417328834533691,6.417328834533691,9.238046646118164,5.802902698516846,1, speaker,True,EleutherAI/pythia-410m,128000,405334016
"For class the kids had to write a poem or a legend, but everyone wrote a legend because it was easier.",legend,dominant,yes,no,7.365081310272217,7.365081310272217,7.365081310272217,4.624312400817871,1.5987013578414917,1, legend,True,EleutherAI/pythia-410m,128000,405334016
For class the kids had to write some kind of tall-tale; everyone wrote a legend because it was easier.,legend,dominant,no,no,7.550477981567383,7.550477981567383,7.550477981567383,6.99497127532959,1.826393723487854,1, legend,True,EleutherAI/pythia-410m,128000,405334016
"At night Sue's mom reads her a story before bed, but last night they didn't read a story since she was in trouble.",story,dominant,yes,no,0.7923413515090942,0.7923413515090942,0.7923413515090942,6.911965847015381,1.6597563028335571,1, story,True,EleutherAI/pythia-410m,128000,405334016
"At night Sue's mom reads her a book before bed, but last night they didn't read a story since she was in trouble.",story,dominant,no,no,3.384554147720337,3.384554147720337,3.384554147720337,6.3123602867126465,1.5730262994766235,1, story,True,EleutherAI/pythia-410m,128000,405334016
"The students forgot to water the flowers and plant, so when they returned from break the plant was dead.",plant,dominant,yes,no,5.281679153442383,5.281679153442383,5.281679153442383,1.7624017000198364,1.74860417842865,1, plant,True,EleutherAI/pythia-410m,128000,405334016
"The students forgot to take care of the garden, so when they returned from break the plant was dead.",plant,dominant,no,no,6.104135990142822,6.104135990142822,6.104135990142822,2.104555130004883,1.8731348514556885,1, plant,True,EleutherAI/pythia-410m,128000,405334016
"The farmer grew potatoes and corn, but he only sold his corn at the local market.",corn,dominant,yes,no,3.1793618202209473,3.1793618202209473,3.1793618202209473,2.981222629547119,0.9518033862113953,1, corn,True,EleutherAI/pythia-410m,128000,405334016
"The farmer grew many crops, but he only sold his corn at the local market.",corn,dominant,no,no,3.9274544715881348,3.9274544715881348,3.9274544715881348,3.1202211380004883,1.0251774787902832,1, corn,True,EleutherAI/pythia-410m,128000,405334016
Addictions and bad habits are hard to overcome because people often don't even realize what bad habit they have.,habit,dominant,yes,no,5.0467071533203125,5.0467071533203125,5.0467071533203125,0.34802380204200745,0.7841548919677734,1, habit,True,EleutherAI/pythia-410m,128000,405334016
Addictions and bad traits are hard to overcome because people often don't even realize what bad habit they have.,habit,dominant,no,no,7.192068099975586,7.192068099975586,7.192068099975586,0.26046231389045715,0.5693737268447876,1, habit,True,EleutherAI/pythia-410m,128000,405334016
"The costume looked good with a tiara or crown, but Pam bought a crown because it was really cheap.",crown,dominant,yes,no,5.023169040679932,5.023169040679932,5.023169040679932,3.544051170349121,1.1761611700057983,1, crown,True,EleutherAI/pythia-410m,128000,405334016
"The costume looked good with a tiara, but Pam bought a crown because it was really cheap.",crown,dominant,no,no,5.796547889709473,5.796547889709473,5.796547889709473,4.160593032836914,1.402090072631836,1, crown,True,EleutherAI/pythia-410m,128000,405334016
"The saleswoman recommended that Gabe try a different suit, but he liked the suit he had on too much to listen.",suit,dominant,yes,no,3.875458002090454,3.875458002090454,3.875458002090454,1.5516138076782227,1.1454598903656006,1, suit,True,EleutherAI/pythia-410m,128000,405334016
"The saleswoman recommended that Gabe try something different, but he liked the suit he had on too much to listen.",suit,dominant,no,no,7.205239295959473,7.205239295959473,7.205239295959473,3.0024895668029785,1.5974864959716797,1, suit,True,EleutherAI/pythia-410m,128000,405334016
"Kristen put her spring coat on, but she changed into her winter coat after she felt how cold it was.",coat,dominant,yes,no,0.7872003316879272,0.7872003316879272,0.7872003316879272,4.657383918762207,2.050032138824463,1, coat,True,EleutherAI/pythia-410m,128000,405334016
"Kristen put her spring jacket on, but she changed into her winter coat after she felt how cold it was.",coat,dominant,no,no,1.1237167119979858,1.1237167119979858,1.1237167119979858,5.0211181640625,2.1493337154388428,1, coat,True,EleutherAI/pythia-410m,128000,405334016
"Cal hoped to see the moon and stars with his telescope, but he couldn't see the stars because of the city lights.",stars,dominant,yes,yes,2.1531262397766113,2.1531262397766113,2.1531262397766113,2.5445685386657715,1.816212773323059,1, stars,True,EleutherAI/pythia-410m,128000,405334016
"Cal hoped to see something with his telescope, but he couldn't see the stars because of the city lights.",stars,dominant,no,yes,2.7058472633361816,2.7058472633361816,2.7058472633361816,3.540968656539917,1.532514214515686,1, stars,True,EleutherAI/pythia-410m,128000,405334016
"Joyce's breakfast was supposed to come with toast, but she substituted potatoes for the toast because of her diet.",toast,dominant,yes,no,2.504831552505493,2.504831552505493,2.504831552505493,5.147897720336914,3.743701934814453,1, toast,True,EleutherAI/pythia-410m,128000,405334016
"Joyce's breakfast was supposed to come with bread, but she substituted potatoes for the toast because of her diet.",toast,dominant,no,no,5.289137840270996,5.289137840270996,5.289137840270996,6.038203239440918,3.6185154914855957,1, toast,True,EleutherAI/pythia-410m,128000,405334016
"Roger rewired the light and changed the bulb, but it still didn't turn on because the bulb he used was wrong.",bulb,dominant,yes,no,2.541024684906006,2.541024684906006,2.541024684906006,6.531143665313721,4.10001277923584,1, bulb,True,EleutherAI/pythia-410m,128000,405334016
"Roger rewired the light, but it still didn't turn on because the bulb he used was wrong.",bulb,dominant,no,no,4.521245956420898,4.521245956420898,4.521245956420898,6.064215183258057,3.824143886566162,1, bulb,True,EleutherAI/pythia-410m,128000,405334016
"Although the managers and staff were worried about potential job cuts, it turned out that none of the staff were let go.",staff,dominant,yes,no,3.0970458984375,3.0970458984375,3.0970458984375,1.9127498865127563,5.828914642333984,1, staff,True,EleutherAI/pythia-410m,128000,405334016
"Although the managers were worried about potential job cuts, it turned out that none of the staff were let go.",staff,dominant,no,no,3.801889419555664,3.801889419555664,3.801889419555664,2.2327380180358887,5.392857551574707,1, staff,True,EleutherAI/pythia-410m,128000,405334016
The patio had one very comfortable chair that Christa wanted because the only other chair was old and broken.,chair,dominant,yes,no,0.7218374609947205,0.7218374609947205,0.7218374609947205,1.9713412523269653,6.525301933288574,1, chair,True,EleutherAI/pythia-410m,128000,405334016
The patio had one very comfortable seat that Christa wanted because the only other chair was old and broken.,chair,dominant,no,no,2.3440334796905518,2.3440334796905518,2.3440334796905518,1.3842356204986572,6.6641950607299805,1, chair,True,EleutherAI/pythia-410m,128000,405334016
