sentence,homophone,condition,repeated,plural,target_token_surprisal,target_span_surprisal_sum,target_span_surprisal_mean,spillover_1_surprisal,spillover_2_surprisal,n_target_tokens,target_token_str,match_found,model,checkpoint,n_params
"Scott was a wrestler and a boxer when he was young, but being a boxer gave him arthritis.",boxer,dominant,yes,no,0.011941022239625454,5.536405629478395,2.7682028147391975,7.642213821411133,0.5228627324104309,2, boxer,True,EleutherAI/pythia-160m,2000,162322944
"Scott was a wrestler and a fighter when he was young, but being a boxer gave him arthritis.",boxer,dominant,no,no,0.7450441718101501,8.058580338954926,4.029290169477463,8.217531204223633,0.4924875497817993,2, boxer,True,EleutherAI/pythia-160m,2000,162322944
"The builder was supposed to put in the new kitchen counter and cabinets, but the selected cabinet style was sold out.",cabinet,dominant,yes,yes,4.4292216300964355,4.4292216300964355,4.4292216300964355,7.6782684326171875,0.7151488661766052,1, cabinet,True,EleutherAI/pythia-160m,2000,162322944
"The builder was supposed to put in the new kitchen, but the selected cabinet style was sold out.",cabinet,dominant,no,yes,6.118831634521484,6.118831634521484,6.118831634521484,8.755840301513672,0.554467499256134,1, cabinet,True,EleutherAI/pythia-160m,2000,162322944
"Mark's favorite band was playing in his town, but back stage passes to meet the band members were sold out.",band,dominant,yes,no,3.7800211906433105,3.7800211906433105,3.7800211906433105,4.268777370452881,2.4565906524658203,1, band,True,EleutherAI/pythia-160m,2000,162322944
"Mark's favorite music group was playing in his town, but back stage passes to meet the band members were sold out.",band,dominant,no,no,4.709245681762695,4.709245681762695,4.709245681762695,3.360642194747925,2.340095281600952,1, band,True,EleutherAI/pythia-160m,2000,162322944
"Maddy always paid attention and took notes, but when she was sick she had to get a copy of the notes from her friend.",notes,dominant,yes,yes,6.184329986572266,6.184329986572266,6.184329986572266,3.3330020904541016,0.5596937537193298,1, notes,True,EleutherAI/pythia-160m,2000,162322944
"Maddy always paid attention and took notes, but when she was sick she had to get a copy of the notes from her friend.",notes,dominant,no,yes,6.184329986572266,6.184329986572266,6.184329986572266,3.3330020904541016,0.5596937537193298,1, notes,True,EleutherAI/pythia-160m,2000,162322944
"Marge was responsible for finding a graduation speaker, so when the speaker canceled last minute she was fired.",speaker,dominant,yes,no,3.5026297569274902,3.5026297569274902,3.5026297569274902,9.738654136657715,6.14370584487915,1, speaker,True,EleutherAI/pythia-160m,2000,162322944
"Marge was responsible for organizing the graduation ceremony, so when the speaker canceled last minute she was fired.",speaker,dominant,no,no,7.5320892333984375,7.5320892333984375,7.5320892333984375,9.241547584533691,6.044342994689941,1, speaker,True,EleutherAI/pythia-160m,2000,162322944
"For class the kids had to write a poem or a legend, but everyone wrote a legend because it was easier.",legend,dominant,yes,no,7.742494583129883,7.742494583129883,7.742494583129883,4.4033966064453125,1.4262840747833252,1, legend,True,EleutherAI/pythia-160m,2000,162322944
For class the kids had to write some kind of tall-tale; everyone wrote a legend because it was easier.,legend,dominant,no,no,9.920247077941895,9.920247077941895,9.920247077941895,5.935827732086182,1.6669105291366577,1, legend,True,EleutherAI/pythia-160m,2000,162322944
"At night Sue's mom reads her a story before bed, but last night they didn't read a story since she was in trouble.",story,dominant,yes,no,2.0241916179656982,2.0241916179656982,2.0241916179656982,5.252795219421387,1.640789270401001,1, story,True,EleutherAI/pythia-160m,2000,162322944
"At night Sue's mom reads her a book before bed, but last night they didn't read a story since she was in trouble.",story,dominant,no,no,3.9315502643585205,3.9315502643585205,3.9315502643585205,5.648866653442383,1.57485830783844,1, story,True,EleutherAI/pythia-160m,2000,162322944
"The students forgot to water the flowers and plant, so when they returned from break the plant was dead.",plant,dominant,yes,no,4.541386127471924,4.541386127471924,4.541386127471924,3.6433684825897217,6.014914512634277,1, plant,True,EleutherAI/pythia-160m,2000,162322944
"The students forgot to take care of the garden, so when they returned from break the plant was dead.",plant,dominant,no,no,6.760305404663086,6.760305404663086,6.760305404663086,3.6155476570129395,6.020822525024414,1, plant,True,EleutherAI/pythia-160m,2000,162322944
"The farmer grew potatoes and corn, but he only sold his corn at the local market.",corn,dominant,yes,no,3.08992075920105,3.08992075920105,3.08992075920105,4.430976867675781,1.1163675785064697,1, corn,True,EleutherAI/pythia-160m,2000,162322944
"The farmer grew many crops, but he only sold his corn at the local market.",corn,dominant,no,no,4.732655048370361,4.732655048370361,4.732655048370361,4.210407257080078,1.1035497188568115,1, corn,True,EleutherAI/pythia-160m,2000,162322944
Addictions and bad habits are hard to overcome because people often don't even realize what bad habit they have.,habit,dominant,yes,no,4.327908515930176,4.327908515930176,4.327908515930176,1.1525092124938965,2.9795336723327637,1, habit,True,EleutherAI/pythia-160m,2000,162322944
Addictions and bad traits are hard to overcome because people often don't even realize what bad habit they have.,habit,dominant,no,no,8.511549949645996,8.511549949645996,8.511549949645996,0.8839058876037598,2.998504877090454,1, habit,True,EleutherAI/pythia-160m,2000,162322944
"The costume looked good with a tiara or crown, but Pam bought a crown because it was really cheap.",crown,dominant,yes,no,6.740847587585449,6.740847587585449,6.740847587585449,6.070940971374512,1.98732590675354,1, crown,True,EleutherAI/pythia-160m,2000,162322944
"The costume looked good with a tiara, but Pam bought a crown because it was really cheap.",crown,dominant,no,no,7.396149635314941,7.396149635314941,7.396149635314941,5.736446857452393,2.081101179122925,1, crown,True,EleutherAI/pythia-160m,2000,162322944
"The saleswoman recommended that Gabe try a different suit, but he liked the suit he had on too much to listen.",suit,dominant,yes,no,3.230358839035034,3.230358839035034,3.230358839035034,4.984577178955078,1.653438925743103,1, suit,True,EleutherAI/pythia-160m,2000,162322944
"The saleswoman recommended that Gabe try something different, but he liked the suit he had on too much to listen.",suit,dominant,no,no,8.779667854309082,8.779667854309082,8.779667854309082,4.45443868637085,1.7882684469223022,1, suit,True,EleutherAI/pythia-160m,2000,162322944
"Kristen put her spring coat on, but she changed into her winter coat after she felt how cold it was.",coat,dominant,yes,no,0.41684743762016296,0.41684743762016296,0.41684743762016296,6.064410209655762,2.3323259353637695,1, coat,True,EleutherAI/pythia-160m,2000,162322944
"Kristen put her spring jacket on, but she changed into her winter coat after she felt how cold it was.",coat,dominant,no,no,2.267667293548584,2.267667293548584,2.267667293548584,6.287600994110107,2.1853525638580322,1, coat,True,EleutherAI/pythia-160m,2000,162322944
"Cal hoped to see the moon and stars with his telescope, but he couldn't see the stars because of the city lights.",stars,dominant,yes,yes,2.350947618484497,2.350947618484497,2.350947618484497,5.515511512756348,2.2772321701049805,1, stars,True,EleutherAI/pythia-160m,2000,162322944
"Cal hoped to see something with his telescope, but he couldn't see the stars because of the city lights.",stars,dominant,no,yes,4.313279151916504,4.313279151916504,4.313279151916504,6.049854278564453,2.5570592880249023,1, stars,True,EleutherAI/pythia-160m,2000,162322944
"Joyce's breakfast was supposed to come with toast, but she substituted potatoes for the toast because of her diet.",toast,dominant,yes,no,6.292787551879883,6.292787551879883,6.292787551879883,5.024518013000488,2.437164306640625,1, toast,True,EleutherAI/pythia-160m,2000,162322944
"Joyce's breakfast was supposed to come with bread, but she substituted potatoes for the toast because of her diet.",toast,dominant,no,no,6.895084381103516,6.895084381103516,6.895084381103516,5.087581634521484,2.378546714782715,1, toast,True,EleutherAI/pythia-160m,2000,162322944
"Roger rewired the light and changed the bulb, but it still didn't turn on because the bulb he used was wrong.",bulb,dominant,yes,no,2.091609477996826,2.091609477996826,2.091609477996826,7.580792427062988,3.6258041858673096,1, bulb,True,EleutherAI/pythia-160m,2000,162322944
"Roger rewired the light, but it still didn't turn on because the bulb he used was wrong.",bulb,dominant,no,no,8.128633499145508,8.128633499145508,8.128633499145508,6.398638725280762,3.487252712249756,1, bulb,True,EleutherAI/pythia-160m,2000,162322944
"Although the managers and staff were worried about potential job cuts, it turned out that none of the staff were let go.",staff,dominant,yes,no,2.804011583328247,2.804011583328247,2.804011583328247,1.727157473564148,8.72264289855957,1, staff,True,EleutherAI/pythia-160m,2000,162322944
"Although the managers were worried about potential job cuts, it turned out that none of the staff were let go.",staff,dominant,no,no,3.3670871257781982,3.3670871257781982,3.3670871257781982,1.7378876209259033,8.778604507446289,1, staff,True,EleutherAI/pythia-160m,2000,162322944
The patio had one very comfortable chair that Christa wanted because the only other chair was old and broken.,chair,dominant,yes,no,2.922421455383301,2.922421455383301,2.922421455383301,1.8561471700668335,8.111113548278809,1, chair,True,EleutherAI/pythia-160m,2000,162322944
The patio had one very comfortable seat that Christa wanted because the only other chair was old and broken.,chair,dominant,no,no,5.749533653259277,5.749533653259277,5.749533653259277,1.7850685119628906,8.069165229797363,1, chair,True,EleutherAI/pythia-160m,2000,162322944
