sentence,homophone,condition,repeated,plural,target_token_surprisal,target_span_surprisal_sum,target_span_surprisal_mean,spillover_1_surprisal,spillover_2_surprisal,n_target_tokens,target_token_str,match_found,model,checkpoint,n_params
"Scott was a wrestler and a boxer when he was young, but being a boxer gave him arthritis.",boxer,dominant,yes,no,11.423333168029785,22.508845329284668,11.254422664642334,10.932761192321777,11.55514907836914,2, boxer,True,EleutherAI/pythia-14m,32,14067712
"Scott was a wrestler and a fighter when he was young, but being a boxer gave him arthritis.",boxer,dominant,no,no,11.328989028930664,22.45217514038086,11.22608757019043,10.922633171081543,11.518000602722168,2, boxer,True,EleutherAI/pythia-14m,32,14067712
"The builder was supposed to put in the new kitchen counter and cabinets, but the selected cabinet style was sold out.",cabinet,dominant,yes,yes,10.286437034606934,10.286437034606934,10.286437034606934,10.943416595458984,9.904462814331055,1, cabinet,True,EleutherAI/pythia-14m,32,14067712
"The builder was supposed to put in the new kitchen, but the selected cabinet style was sold out.",cabinet,dominant,no,yes,10.273496627807617,10.273496627807617,10.273496627807617,10.91433048248291,9.93751049041748,1, cabinet,True,EleutherAI/pythia-14m,32,14067712
"Mark's favorite band was playing in his town, but back stage passes to meet the band members were sold out.",band,dominant,yes,no,10.874465942382812,10.874465942382812,10.874465942382812,11.417247772216797,10.539587020874023,1, band,True,EleutherAI/pythia-14m,32,14067712
"Mark's favorite music group was playing in his town, but back stage passes to meet the band members were sold out.",band,dominant,no,no,10.785579681396484,10.785579681396484,10.785579681396484,11.317900657653809,10.637866020202637,1, band,True,EleutherAI/pythia-14m,32,14067712
"Maddy always paid attention and took notes, but when she was sick she had to get a copy of the notes from her friend.",notes,dominant,yes,yes,11.194488525390625,11.194488525390625,11.194488525390625,10.245576858520508,10.595683097839355,1, notes,True,EleutherAI/pythia-14m,32,14067712
"Maddy always paid attention and took notes, but when she was sick she had to get a copy of the notes from her friend.",notes,dominant,no,yes,11.194488525390625,11.194488525390625,11.194488525390625,10.245576858520508,10.595683097839355,1, notes,True,EleutherAI/pythia-14m,32,14067712
"Marge was responsible for finding a graduation speaker, so when the speaker canceled last minute she was fired.",speaker,dominant,yes,no,10.881784439086914,10.881784439086914,10.881784439086914,10.091764450073242,10.686028480529785,1, speaker,True,EleutherAI/pythia-14m,32,14067712
"Marge was responsible for organizing the graduation ceremony, so when the speaker canceled last minute she was fired.",speaker,dominant,no,no,10.950690269470215,10.950690269470215,10.950690269470215,10.221845626831055,10.538361549377441,1, speaker,True,EleutherAI/pythia-14m,32,14067712
"For class the kids had to write a poem or a legend, but everyone wrote a legend because it was easier.",legend,dominant,yes,no,11.442716598510742,11.442716598510742,11.442716598510742,10.746837615966797,11.217939376831055,1, legend,True,EleutherAI/pythia-14m,32,14067712
For class the kids had to write some kind of tall-tale; everyone wrote a legend because it was easier.,legend,dominant,no,no,11.677796363830566,11.677796363830566,11.677796363830566,10.7234468460083,11.250715255737305,1, legend,True,EleutherAI/pythia-14m,32,14067712
"At night Sue's mom reads her a story before bed, but last night they didn't read a story since she was in trouble.",story,dominant,yes,no,11.532817840576172,11.532817840576172,11.532817840576172,10.973093032836914,10.813143730163574,1, story,True,EleutherAI/pythia-14m,32,14067712
"At night Sue's mom reads her a book before bed, but last night they didn't read a story since she was in trouble.",story,dominant,no,no,11.579764366149902,11.579764366149902,11.579764366149902,11.0010986328125,10.799598693847656,1, story,True,EleutherAI/pythia-14m,32,14067712
"The students forgot to water the flowers and plant, so when they returned from break the plant was dead.",plant,dominant,yes,no,10.920259475708008,10.920259475708008,10.920259475708008,10.740185737609863,10.819808006286621,1, plant,True,EleutherAI/pythia-14m,32,14067712
"The students forgot to take care of the garden, so when they returned from break the plant was dead.",plant,dominant,no,no,11.234746932983398,11.234746932983398,11.234746932983398,11.137957572937012,10.85024642944336,1, plant,True,EleutherAI/pythia-14m,32,14067712
"The farmer grew potatoes and corn, but he only sold his corn at the local market.",corn,dominant,yes,no,11.717127799987793,11.717127799987793,11.717127799987793,10.25538444519043,9.346062660217285,1, corn,True,EleutherAI/pythia-14m,32,14067712
"The farmer grew many crops, but he only sold his corn at the local market.",corn,dominant,no,no,11.547962188720703,11.547962188720703,11.547962188720703,10.293388366699219,9.352132797241211,1, corn,True,EleutherAI/pythia-14m,32,14067712
Addictions and bad habits are hard to overcome because people often don't even realize what bad habit they have.,habit,dominant,yes,no,12.053869247436523,12.053869247436523,12.053869247436523,10.94775104522705,10.189352035522461,1, habit,True,EleutherAI/pythia-14m,32,14067712
Addictions and bad traits are hard to overcome because people often don't even realize what bad habit they have.,habit,dominant,no,no,11.860729217529297,11.860729217529297,11.860729217529297,10.856622695922852,10.189849853515625,1, habit,True,EleutherAI/pythia-14m,32,14067712
"The costume looked good with a tiara or crown, but Pam bought a crown because it was really cheap.",crown,dominant,yes,no,12.300365447998047,12.300365447998047,12.300365447998047,10.24472427368164,11.152227401733398,1, crown,True,EleutherAI/pythia-14m,32,14067712
"The costume looked good with a tiara, but Pam bought a crown because it was really cheap.",crown,dominant,no,no,12.257018089294434,12.257018089294434,12.257018089294434,10.209428787231445,11.239547729492188,1, crown,True,EleutherAI/pythia-14m,32,14067712
"The saleswoman recommended that Gabe try a different suit, but he liked the suit he had on too much to listen.",suit,dominant,yes,no,11.916555404663086,11.916555404663086,11.916555404663086,11.76268196105957,11.2249116897583,1, suit,True,EleutherAI/pythia-14m,32,14067712
"The saleswoman recommended that Gabe try something different, but he liked the suit he had on too much to listen.",suit,dominant,no,no,11.89145565032959,11.89145565032959,11.89145565032959,11.769790649414062,11.269685745239258,1, suit,True,EleutherAI/pythia-14m,32,14067712
"Kristen put her spring coat on, but she changed into her winter coat after she felt how cold it was.",coat,dominant,yes,no,11.07066822052002,11.07066822052002,11.07066822052002,10.947336196899414,11.220541000366211,1, coat,True,EleutherAI/pythia-14m,32,14067712
"Kristen put her spring jacket on, but she changed into her winter coat after she felt how cold it was.",coat,dominant,no,no,11.199788093566895,11.199788093566895,11.199788093566895,10.896566390991211,11.219385147094727,1, coat,True,EleutherAI/pythia-14m,32,14067712
"Cal hoped to see the moon and stars with his telescope, but he couldn't see the stars because of the city lights.",stars,dominant,yes,yes,11.312338829040527,11.312338829040527,11.312338829040527,11.812737464904785,10.38703441619873,1, stars,True,EleutherAI/pythia-14m,32,14067712
"Cal hoped to see something with his telescope, but he couldn't see the stars because of the city lights.",stars,dominant,no,yes,11.419827461242676,11.419827461242676,11.419827461242676,11.758708000183105,10.398604393005371,1, stars,True,EleutherAI/pythia-14m,32,14067712
"Joyce's breakfast was supposed to come with toast, but she substituted potatoes for the toast because of her diet.",toast,dominant,yes,no,10.57337760925293,10.57337760925293,10.57337760925293,11.04289436340332,10.423160552978516,1, toast,True,EleutherAI/pythia-14m,32,14067712
"Joyce's breakfast was supposed to come with bread, but she substituted potatoes for the toast because of her diet.",toast,dominant,no,no,10.531424522399902,10.531424522399902,10.531424522399902,11.047664642333984,10.489349365234375,1, toast,True,EleutherAI/pythia-14m,32,14067712
"Roger rewired the light and changed the bulb, but it still didn't turn on because the bulb he used was wrong.",bulb,dominant,yes,no,9.7587890625,9.7587890625,9.7587890625,11.716232299804688,9.717327117919922,1, bulb,True,EleutherAI/pythia-14m,32,14067712
"Roger rewired the light, but it still didn't turn on because the bulb he used was wrong.",bulb,dominant,no,no,9.78259563446045,9.78259563446045,9.78259563446045,11.684565544128418,9.816946983337402,1, bulb,True,EleutherAI/pythia-14m,32,14067712
"Although the managers and staff were worried about potential job cuts, it turned out that none of the staff were let go.",staff,dominant,yes,no,10.066828727722168,10.066828727722168,10.066828727722168,11.150318145751953,10.880966186523438,1, staff,True,EleutherAI/pythia-14m,32,14067712
"Although the managers were worried about potential job cuts, it turned out that none of the staff were let go.",staff,dominant,no,no,9.929282188415527,9.929282188415527,9.929282188415527,11.168852806091309,10.860612869262695,1, staff,True,EleutherAI/pythia-14m,32,14067712
The patio had one very comfortable chair that Christa wanted because the only other chair was old and broken.,chair,dominant,yes,no,12.113593101501465,12.113593101501465,12.113593101501465,11.373672485351562,12.096336364746094,1, chair,True,EleutherAI/pythia-14m,32,14067712
The patio had one very comfortable seat that Christa wanted because the only other chair was old and broken.,chair,dominant,no,no,12.10830307006836,12.10830307006836,12.10830307006836,11.593613624572754,12.049280166625977,1, chair,True,EleutherAI/pythia-14m,32,14067712
