sentence,homophone,condition,repeated,plural,target_token_surprisal,target_span_surprisal_sum,target_span_surprisal_mean,spillover_1_surprisal,spillover_2_surprisal,n_target_tokens,target_token_str,match_found,model,checkpoint,n_params
"Scott was a wrestler and a boxer when he was young, but being a boxer gave him arthritis.",boxer,dominant,yes,no,10.632617950439453,21.79493522644043,10.897467613220215,10.941496849060059,10.394750595092773,2, boxer,True,EleutherAI/pythia-410m,4,405334016
"Scott was a wrestler and a fighter when he was young, but being a boxer gave him arthritis.",boxer,dominant,no,no,10.56061840057373,21.76355743408203,10.881778717041016,10.911632537841797,10.48935317993164,2, boxer,True,EleutherAI/pythia-410m,4,405334016
"The builder was supposed to put in the new kitchen counter and cabinets, but the selected cabinet style was sold out.",cabinet,dominant,yes,yes,10.788146018981934,10.788146018981934,10.788146018981934,12.209297180175781,11.634074211120605,1, cabinet,True,EleutherAI/pythia-410m,4,405334016
"The builder was supposed to put in the new kitchen, but the selected cabinet style was sold out.",cabinet,dominant,no,yes,10.75060749053955,10.75060749053955,10.75060749053955,12.201244354248047,11.603202819824219,1, cabinet,True,EleutherAI/pythia-410m,4,405334016
"Mark's favorite band was playing in his town, but back stage passes to meet the band members were sold out.",band,dominant,yes,no,10.663564682006836,10.663564682006836,10.663564682006836,11.179208755493164,11.486458778381348,1, band,True,EleutherAI/pythia-410m,4,405334016
"Mark's favorite music group was playing in his town, but back stage passes to meet the band members were sold out.",band,dominant,no,no,10.526768684387207,10.526768684387207,10.526768684387207,11.262467384338379,11.529375076293945,1, band,True,EleutherAI/pythia-410m,4,405334016
"Maddy always paid attention and took notes, but when she was sick she had to get a copy of the notes from her friend.",notes,dominant,yes,yes,10.60456371307373,10.60456371307373,10.60456371307373,10.998979568481445,11.308475494384766,1, notes,True,EleutherAI/pythia-410m,4,405334016
"Maddy always paid attention and took notes, but when she was sick she had to get a copy of the notes from her friend.",notes,dominant,no,yes,10.60456371307373,10.60456371307373,10.60456371307373,10.998979568481445,11.308475494384766,1, notes,True,EleutherAI/pythia-410m,4,405334016
"Marge was responsible for finding a graduation speaker, so when the speaker canceled last minute she was fired.",speaker,dominant,yes,no,10.883291244506836,10.883291244506836,10.883291244506836,10.44125747680664,9.854021072387695,1, speaker,True,EleutherAI/pythia-410m,4,405334016
"Marge was responsible for organizing the graduation ceremony, so when the speaker canceled last minute she was fired.",speaker,dominant,no,no,11.13704776763916,11.13704776763916,11.13704776763916,10.256105422973633,9.762235641479492,1, speaker,True,EleutherAI/pythia-410m,4,405334016
"For class the kids had to write a poem or a legend, but everyone wrote a legend because it was easier.",legend,dominant,yes,no,12.320789337158203,12.320789337158203,12.320789337158203,11.27617359161377,10.50786018371582,1, legend,True,EleutherAI/pythia-410m,4,405334016
For class the kids had to write some kind of tall-tale; everyone wrote a legend because it was easier.,legend,dominant,no,no,12.579984664916992,12.579984664916992,12.579984664916992,11.181461334228516,10.40546989440918,1, legend,True,EleutherAI/pythia-410m,4,405334016
"At night Sue's mom reads her a story before bed, but last night they didn't read a story since she was in trouble.",story,dominant,yes,no,12.24395751953125,12.24395751953125,12.24395751953125,12.223817825317383,10.946114540100098,1, story,True,EleutherAI/pythia-410m,4,405334016
"At night Sue's mom reads her a book before bed, but last night they didn't read a story since she was in trouble.",story,dominant,no,no,12.285858154296875,12.285858154296875,12.285858154296875,12.201385498046875,10.963008880615234,1, story,True,EleutherAI/pythia-410m,4,405334016
"The students forgot to water the flowers and plant, so when they returned from break the plant was dead.",plant,dominant,yes,no,11.361922264099121,11.361922264099121,11.361922264099121,10.4336576461792,10.521536827087402,1, plant,True,EleutherAI/pythia-410m,4,405334016
"The students forgot to take care of the garden, so when they returned from break the plant was dead.",plant,dominant,no,no,11.292067527770996,11.292067527770996,11.292067527770996,10.248023986816406,10.930497169494629,1, plant,True,EleutherAI/pythia-410m,4,405334016
"The farmer grew potatoes and corn, but he only sold his corn at the local market.",corn,dominant,yes,no,10.430521011352539,10.430521011352539,10.430521011352539,11.1940279006958,9.772387504577637,1, corn,True,EleutherAI/pythia-410m,4,405334016
"The farmer grew many crops, but he only sold his corn at the local market.",corn,dominant,no,no,10.337078094482422,10.337078094482422,10.337078094482422,10.961797714233398,9.78331184387207,1, corn,True,EleutherAI/pythia-410m,4,405334016
Addictions and bad habits are hard to overcome because people often don't even realize what bad habit they have.,habit,dominant,yes,no,11.770584106445312,11.770584106445312,11.770584106445312,10.21117115020752,11.238832473754883,1, habit,True,EleutherAI/pythia-410m,4,405334016
Addictions and bad traits are hard to overcome because people often don't even realize what bad habit they have.,habit,dominant,no,no,11.834805488586426,11.834805488586426,11.834805488586426,10.256269454956055,11.160515785217285,1, habit,True,EleutherAI/pythia-410m,4,405334016
"The costume looked good with a tiara or crown, but Pam bought a crown because it was really cheap.",crown,dominant,yes,no,10.669212341308594,10.669212341308594,10.669212341308594,10.935630798339844,10.335673332214355,1, crown,True,EleutherAI/pythia-410m,4,405334016
"The costume looked good with a tiara, but Pam bought a crown because it was really cheap.",crown,dominant,no,no,10.660490036010742,10.660490036010742,10.660490036010742,10.939806938171387,10.201866149902344,1, crown,True,EleutherAI/pythia-410m,4,405334016
"The saleswoman recommended that Gabe try a different suit, but he liked the suit he had on too much to listen.",suit,dominant,yes,no,11.342215538024902,11.342215538024902,11.342215538024902,11.186868667602539,10.753210067749023,1, suit,True,EleutherAI/pythia-410m,4,405334016
"The saleswoman recommended that Gabe try something different, but he liked the suit he had on too much to listen.",suit,dominant,no,no,11.393388748168945,11.393388748168945,11.393388748168945,11.041929244995117,10.676923751831055,1, suit,True,EleutherAI/pythia-410m,4,405334016
"Kristen put her spring coat on, but she changed into her winter coat after she felt how cold it was.",coat,dominant,yes,no,11.142023086547852,11.142023086547852,11.142023086547852,10.753507614135742,11.46131420135498,1, coat,True,EleutherAI/pythia-410m,4,405334016
"Kristen put her spring jacket on, but she changed into her winter coat after she felt how cold it was.",coat,dominant,no,no,11.229593276977539,11.229593276977539,11.229593276977539,10.800264358520508,11.254119873046875,1, coat,True,EleutherAI/pythia-410m,4,405334016
"Cal hoped to see the moon and stars with his telescope, but he couldn't see the stars because of the city lights.",stars,dominant,yes,yes,10.873414993286133,10.873414993286133,10.873414993286133,11.231348991394043,10.212632179260254,1, stars,True,EleutherAI/pythia-410m,4,405334016
"Cal hoped to see something with his telescope, but he couldn't see the stars because of the city lights.",stars,dominant,no,yes,10.736061096191406,10.736061096191406,10.736061096191406,11.260659217834473,10.467412948608398,1, stars,True,EleutherAI/pythia-410m,4,405334016
"Joyce's breakfast was supposed to come with toast, but she substituted potatoes for the toast because of her diet.",toast,dominant,yes,no,10.685314178466797,10.685314178466797,10.685314178466797,10.752167701721191,10.63856029510498,1, toast,True,EleutherAI/pythia-410m,4,405334016
"Joyce's breakfast was supposed to come with bread, but she substituted potatoes for the toast because of her diet.",toast,dominant,no,no,10.735389709472656,10.735389709472656,10.735389709472656,10.635772705078125,10.597674369812012,1, toast,True,EleutherAI/pythia-410m,4,405334016
"Roger rewired the light and changed the bulb, but it still didn't turn on because the bulb he used was wrong.",bulb,dominant,yes,no,11.410257339477539,11.410257339477539,11.410257339477539,11.231435775756836,10.742958068847656,1, bulb,True,EleutherAI/pythia-410m,4,405334016
"Roger rewired the light, but it still didn't turn on because the bulb he used was wrong.",bulb,dominant,no,no,11.409978866577148,11.409978866577148,11.409978866577148,11.371173858642578,10.75334644317627,1, bulb,True,EleutherAI/pythia-410m,4,405334016
"Although the managers and staff were worried about potential job cuts, it turned out that none of the staff were let go.",staff,dominant,yes,no,11.516568183898926,11.516568183898926,11.516568183898926,11.441033363342285,11.17123794555664,1, staff,True,EleutherAI/pythia-410m,4,405334016
"Although the managers were worried about potential job cuts, it turned out that none of the staff were let go.",staff,dominant,no,no,11.588897705078125,11.588897705078125,11.588897705078125,11.560629844665527,11.04660701751709,1, staff,True,EleutherAI/pythia-410m,4,405334016
The patio had one very comfortable chair that Christa wanted because the only other chair was old and broken.,chair,dominant,yes,no,11.03906536102295,11.03906536102295,11.03906536102295,10.290666580200195,10.86639404296875,1, chair,True,EleutherAI/pythia-410m,4,405334016
The patio had one very comfortable seat that Christa wanted because the only other chair was old and broken.,chair,dominant,no,no,10.954472541809082,10.954472541809082,10.954472541809082,10.455967903137207,10.96312427520752,1, chair,True,EleutherAI/pythia-410m,4,405334016
