sentence,homophone,condition,repeated,plural,target_token_surprisal,target_span_surprisal_sum,target_span_surprisal_mean,spillover_1_surprisal,spillover_2_surprisal,n_target_tokens,target_token_str,match_found,model,checkpoint,n_params
"Scott was a wrestler and a boxer when he was young, but being a boxer gave him arthritis.",boxer,dominant,yes,no,10.872735023498535,22.10505485534668,11.05252742767334,10.916385650634766,10.338150024414062,2, boxer,True,EleutherAI/pythia-410m,2,405334016
"Scott was a wrestler and a fighter when he was young, but being a boxer gave him arthritis.",boxer,dominant,no,no,10.794150352478027,22.06339740753174,11.03169870376587,10.885327339172363,10.424857139587402,2, boxer,True,EleutherAI/pythia-410m,2,405334016
"The builder was supposed to put in the new kitchen counter and cabinets, but the selected cabinet style was sold out.",cabinet,dominant,yes,yes,10.605267524719238,10.605267524719238,10.605267524719238,12.130456924438477,11.4417085647583,1, cabinet,True,EleutherAI/pythia-410m,2,405334016
"The builder was supposed to put in the new kitchen, but the selected cabinet style was sold out.",cabinet,dominant,no,yes,10.560985565185547,10.560985565185547,10.560985565185547,12.120319366455078,11.416234016418457,1, cabinet,True,EleutherAI/pythia-410m,2,405334016
"Mark's favorite band was playing in his town, but back stage passes to meet the band members were sold out.",band,dominant,yes,no,10.454755783081055,10.454755783081055,10.454755783081055,11.269063949584961,11.65842056274414,1, band,True,EleutherAI/pythia-410m,2,405334016
"Mark's favorite music group was playing in his town, but back stage passes to meet the band members were sold out.",band,dominant,no,no,10.311805725097656,10.311805725097656,10.311805725097656,11.335783004760742,11.723782539367676,1, band,True,EleutherAI/pythia-410m,2,405334016
"Maddy always paid attention and took notes, but when she was sick she had to get a copy of the notes from her friend.",notes,dominant,yes,yes,10.673219680786133,10.673219680786133,10.673219680786133,10.878331184387207,11.386122703552246,1, notes,True,EleutherAI/pythia-410m,2,405334016
"Maddy always paid attention and took notes, but when she was sick she had to get a copy of the notes from her friend.",notes,dominant,no,yes,10.673219680786133,10.673219680786133,10.673219680786133,10.878331184387207,11.386122703552246,1, notes,True,EleutherAI/pythia-410m,2,405334016
"Marge was responsible for finding a graduation speaker, so when the speaker canceled last minute she was fired.",speaker,dominant,yes,no,10.896246910095215,10.896246910095215,10.896246910095215,10.394618034362793,9.988419532775879,1, speaker,True,EleutherAI/pythia-410m,2,405334016
"Marge was responsible for organizing the graduation ceremony, so when the speaker canceled last minute she was fired.",speaker,dominant,no,no,11.142539024353027,11.142539024353027,11.142539024353027,10.205224990844727,9.876724243164062,1, speaker,True,EleutherAI/pythia-410m,2,405334016
"For class the kids had to write a poem or a legend, but everyone wrote a legend because it was easier.",legend,dominant,yes,no,12.250114440917969,12.250114440917969,12.250114440917969,11.276640892028809,10.5986909866333,1, legend,True,EleutherAI/pythia-410m,2,405334016
For class the kids had to write some kind of tall-tale; everyone wrote a legend because it was easier.,legend,dominant,no,no,12.510661125183105,12.510661125183105,12.510661125183105,11.169618606567383,10.501294136047363,1, legend,True,EleutherAI/pythia-410m,2,405334016
"At night Sue's mom reads her a story before bed, but last night they didn't read a story since she was in trouble.",story,dominant,yes,no,12.270105361938477,12.270105361938477,12.270105361938477,12.254057884216309,11.061975479125977,1, story,True,EleutherAI/pythia-410m,2,405334016
"At night Sue's mom reads her a book before bed, but last night they didn't read a story since she was in trouble.",story,dominant,no,no,12.310272216796875,12.310272216796875,12.310272216796875,12.225988388061523,11.077392578125,1, story,True,EleutherAI/pythia-410m,2,405334016
"The students forgot to water the flowers and plant, so when they returned from break the plant was dead.",plant,dominant,yes,no,11.407346725463867,11.407346725463867,11.407346725463867,10.261795043945312,10.371631622314453,1, plant,True,EleutherAI/pythia-410m,2,405334016
"The students forgot to take care of the garden, so when they returned from break the plant was dead.",plant,dominant,no,no,11.314789772033691,11.314789772033691,11.314789772033691,10.076910972595215,10.798273086547852,1, plant,True,EleutherAI/pythia-410m,2,405334016
"The farmer grew potatoes and corn, but he only sold his corn at the local market.",corn,dominant,yes,no,10.504410743713379,10.504410743713379,10.504410743713379,11.14677906036377,10.414325714111328,1, corn,True,EleutherAI/pythia-410m,2,405334016
"The farmer grew many crops, but he only sold his corn at the local market.",corn,dominant,no,no,10.416349411010742,10.416349411010742,10.416349411010742,10.91784954071045,10.397378921508789,1, corn,True,EleutherAI/pythia-410m,2,405334016
Addictions and bad habits are hard to overcome because people often don't even realize what bad habit they have.,habit,dominant,yes,no,12.055305480957031,12.055305480957031,12.055305480957031,10.218659400939941,11.286052703857422,1, habit,True,EleutherAI/pythia-410m,2,405334016
Addictions and bad traits are hard to overcome because people often don't even realize what bad habit they have.,habit,dominant,no,no,12.106471061706543,12.106471061706543,12.106471061706543,10.26864242553711,11.20600700378418,1, habit,True,EleutherAI/pythia-410m,2,405334016
"The costume looked good with a tiara or crown, but Pam bought a crown because it was really cheap.",crown,dominant,yes,no,10.638206481933594,10.638206481933594,10.638206481933594,10.973998069763184,10.402671813964844,1, crown,True,EleutherAI/pythia-410m,2,405334016
"The costume looked good with a tiara, but Pam bought a crown because it was really cheap.",crown,dominant,no,no,10.635629653930664,10.635629653930664,10.635629653930664,10.967090606689453,10.262321472167969,1, crown,True,EleutherAI/pythia-410m,2,405334016
"The saleswoman recommended that Gabe try a different suit, but he liked the suit he had on too much to listen.",suit,dominant,yes,no,11.33197021484375,11.33197021484375,11.33197021484375,11.263986587524414,10.794310569763184,1, suit,True,EleutherAI/pythia-410m,2,405334016
"The saleswoman recommended that Gabe try something different, but he liked the suit he had on too much to listen.",suit,dominant,no,no,11.38845157623291,11.38845157623291,11.38845157623291,11.114036560058594,10.710958480834961,1, suit,True,EleutherAI/pythia-410m,2,405334016
"Kristen put her spring coat on, but she changed into her winter coat after she felt how cold it was.",coat,dominant,yes,no,11.281733512878418,11.281733512878418,11.281733512878418,10.709218978881836,11.564352035522461,1, coat,True,EleutherAI/pythia-410m,2,405334016
"Kristen put her spring jacket on, but she changed into her winter coat after she felt how cold it was.",coat,dominant,no,no,11.369488716125488,11.369488716125488,11.369488716125488,10.760035514831543,11.360859870910645,1, coat,True,EleutherAI/pythia-410m,2,405334016
"Cal hoped to see the moon and stars with his telescope, but he couldn't see the stars because of the city lights.",stars,dominant,yes,yes,10.96059799194336,10.96059799194336,10.96059799194336,11.283743858337402,10.671209335327148,1, stars,True,EleutherAI/pythia-410m,2,405334016
"Cal hoped to see something with his telescope, but he couldn't see the stars because of the city lights.",stars,dominant,no,yes,10.808586120605469,10.808586120605469,10.808586120605469,11.312138557434082,10.907275199890137,1, stars,True,EleutherAI/pythia-410m,2,405334016
"Joyce's breakfast was supposed to come with toast, but she substituted potatoes for the toast because of her diet.",toast,dominant,yes,no,10.599298477172852,10.599298477172852,10.599298477172852,10.811661720275879,11.073697090148926,1, toast,True,EleutherAI/pythia-410m,2,405334016
"Joyce's breakfast was supposed to come with bread, but she substituted potatoes for the toast because of her diet.",toast,dominant,no,no,10.641088485717773,10.641088485717773,10.641088485717773,10.687798500061035,11.020861625671387,1, toast,True,EleutherAI/pythia-410m,2,405334016
"Roger rewired the light and changed the bulb, but it still didn't turn on because the bulb he used was wrong.",bulb,dominant,yes,no,11.401288032531738,11.401288032531738,11.401288032531738,11.306325912475586,10.779128074645996,1, bulb,True,EleutherAI/pythia-410m,2,405334016
"Roger rewired the light, but it still didn't turn on because the bulb he used was wrong.",bulb,dominant,no,no,11.396639823913574,11.396639823913574,11.396639823913574,11.45210075378418,10.790226936340332,1, bulb,True,EleutherAI/pythia-410m,2,405334016
"Although the managers and staff were worried about potential job cuts, it turned out that none of the staff were let go.",staff,dominant,yes,no,11.410355567932129,11.410355567932129,11.410355567932129,11.595832824707031,11.055120468139648,1, staff,True,EleutherAI/pythia-410m,2,405334016
"Although the managers were worried about potential job cuts, it turned out that none of the staff were let go.",staff,dominant,no,no,11.497413635253906,11.497413635253906,11.497413635253906,11.714834213256836,10.938462257385254,1, staff,True,EleutherAI/pythia-410m,2,405334016
The patio had one very comfortable chair that Christa wanted because the only other chair was old and broken.,chair,dominant,yes,no,11.068206787109375,11.068206787109375,11.068206787109375,10.133546829223633,10.80427360534668,1, chair,True,EleutherAI/pythia-410m,2,405334016
The patio had one very comfortable seat that Christa wanted because the only other chair was old and broken.,chair,dominant,no,no,10.99038314819336,10.99038314819336,10.99038314819336,10.299813270568848,10.904032707214355,1, chair,True,EleutherAI/pythia-410m,2,405334016
