sentence,homophone,condition,repeated,plural,target_token_surprisal,target_span_surprisal_sum,target_span_surprisal_mean,spillover_1_surprisal,spillover_2_surprisal,n_target_tokens,target_token_str,match_found,model,checkpoint,n_params
"Scott was a wrestler and a boxer when he was young, but being a boxer gave him arthritis.",boxer,dominant,yes,no,0.0034395840484648943,5.209757962496951,2.6048789812484756,7.0066375732421875,0.5091015100479126,2, boxer,True,EleutherAI/pythia-70m,16000,70426624
"Scott was a wrestler and a fighter when he was young, but being a boxer gave him arthritis.",boxer,dominant,no,no,0.1996130496263504,6.84051938354969,3.420259691774845,7.051825523376465,0.5652360916137695,2, boxer,True,EleutherAI/pythia-70m,16000,70426624
"The builder was supposed to put in the new kitchen counter and cabinets, but the selected cabinet style was sold out.",cabinet,dominant,yes,yes,3.8487284183502197,3.8487284183502197,3.8487284183502197,8.855955123901367,1.1877493858337402,1, cabinet,True,EleutherAI/pythia-70m,16000,70426624
"The builder was supposed to put in the new kitchen, but the selected cabinet style was sold out.",cabinet,dominant,no,yes,6.105771064758301,6.105771064758301,6.105771064758301,9.097772598266602,1.1413753032684326,1, cabinet,True,EleutherAI/pythia-70m,16000,70426624
"Mark's favorite band was playing in his town, but back stage passes to meet the band members were sold out.",band,dominant,yes,no,2.383241653442383,2.383241653442383,2.383241653442383,3.7139687538146973,4.575716972351074,1, band,True,EleutherAI/pythia-70m,16000,70426624
"Mark's favorite music group was playing in his town, but back stage passes to meet the band members were sold out.",band,dominant,no,no,3.250443935394287,3.250443935394287,3.250443935394287,3.5276994705200195,4.848489284515381,1, band,True,EleutherAI/pythia-70m,16000,70426624
"Maddy always paid attention and took notes, but when she was sick she had to get a copy of the notes from her friend.",notes,dominant,yes,yes,6.603838920593262,6.603838920593262,6.603838920593262,3.361985206604004,1.1347477436065674,1, notes,True,EleutherAI/pythia-70m,16000,70426624
"Maddy always paid attention and took notes, but when she was sick she had to get a copy of the notes from her friend.",notes,dominant,no,yes,6.603838920593262,6.603838920593262,6.603838920593262,3.361985206604004,1.1347477436065674,1, notes,True,EleutherAI/pythia-70m,16000,70426624
"Marge was responsible for finding a graduation speaker, so when the speaker canceled last minute she was fired.",speaker,dominant,yes,no,3.694026470184326,3.694026470184326,3.694026470184326,8.86131477355957,6.288994789123535,1, speaker,True,EleutherAI/pythia-70m,16000,70426624
"Marge was responsible for organizing the graduation ceremony, so when the speaker canceled last minute she was fired.",speaker,dominant,no,no,8.304201126098633,8.304201126098633,8.304201126098633,7.698698997497559,6.039388656616211,1, speaker,True,EleutherAI/pythia-70m,16000,70426624
"For class the kids had to write a poem or a legend, but everyone wrote a legend because it was easier.",legend,dominant,yes,no,7.867112636566162,7.867112636566162,7.867112636566162,4.940614223480225,1.6980804204940796,1, legend,True,EleutherAI/pythia-70m,16000,70426624
For class the kids had to write some kind of tall-tale; everyone wrote a legend because it was easier.,legend,dominant,no,no,11.45792007446289,11.45792007446289,11.45792007446289,6.296431541442871,1.9679155349731445,1, legend,True,EleutherAI/pythia-70m,16000,70426624
"At night Sue's mom reads her a story before bed, but last night they didn't read a story since she was in trouble.",story,dominant,yes,no,0.4604627192020416,0.4604627192020416,0.4604627192020416,5.19511604309082,1.3477002382278442,1, story,True,EleutherAI/pythia-70m,16000,70426624
"At night Sue's mom reads her a book before bed, but last night they didn't read a story since she was in trouble.",story,dominant,no,no,4.435512542724609,4.435512542724609,4.435512542724609,5.799053192138672,1.3884693384170532,1, story,True,EleutherAI/pythia-70m,16000,70426624
"The students forgot to water the flowers and plant, so when they returned from break the plant was dead.",plant,dominant,yes,no,4.306747913360596,4.306747913360596,4.306747913360596,2.140932083129883,5.06281852722168,1, plant,True,EleutherAI/pythia-70m,16000,70426624
"The students forgot to take care of the garden, so when they returned from break the plant was dead.",plant,dominant,no,no,5.668803691864014,5.668803691864014,5.668803691864014,2.1641478538513184,5.578510761260986,1, plant,True,EleutherAI/pythia-70m,16000,70426624
"The farmer grew potatoes and corn, but he only sold his corn at the local market.",corn,dominant,yes,no,1.8468210697174072,1.8468210697174072,1.8468210697174072,4.536815166473389,1.3905264139175415,1, corn,True,EleutherAI/pythia-70m,16000,70426624
"The farmer grew many crops, but he only sold his corn at the local market.",corn,dominant,no,no,3.9010138511657715,3.9010138511657715,3.9010138511657715,4.17951774597168,1.735963225364685,1, corn,True,EleutherAI/pythia-70m,16000,70426624
Addictions and bad habits are hard to overcome because people often don't even realize what bad habit they have.,habit,dominant,yes,no,4.291601657867432,4.291601657867432,4.291601657867432,2.2253971099853516,2.2860641479492188,1, habit,True,EleutherAI/pythia-70m,16000,70426624
Addictions and bad traits are hard to overcome because people often don't even realize what bad habit they have.,habit,dominant,no,no,8.558219909667969,8.558219909667969,8.558219909667969,1.8395671844482422,2.116832733154297,1, habit,True,EleutherAI/pythia-70m,16000,70426624
"The costume looked good with a tiara or crown, but Pam bought a crown because it was really cheap.",crown,dominant,yes,no,4.994912147521973,4.994912147521973,4.994912147521973,5.647494792938232,1.5018635988235474,1, crown,True,EleutherAI/pythia-70m,16000,70426624
"The costume looked good with a tiara, but Pam bought a crown because it was really cheap.",crown,dominant,no,no,7.461076736450195,7.461076736450195,7.461076736450195,6.232047080993652,1.7197983264923096,1, crown,True,EleutherAI/pythia-70m,16000,70426624
"The saleswoman recommended that Gabe try a different suit, but he liked the suit he had on too much to listen.",suit,dominant,yes,no,3.0896427631378174,3.0896427631378174,3.0896427631378174,4.0078444480896,1.6684547662734985,1, suit,True,EleutherAI/pythia-70m,16000,70426624
"The saleswoman recommended that Gabe try something different, but he liked the suit he had on too much to listen.",suit,dominant,no,no,8.422358512878418,8.422358512878418,8.422358512878418,4.158506393432617,1.8409677743911743,1, suit,True,EleutherAI/pythia-70m,16000,70426624
"Kristen put her spring coat on, but she changed into her winter coat after she felt how cold it was.",coat,dominant,yes,no,0.14936262369155884,0.14936262369155884,0.14936262369155884,5.397029399871826,2.1793060302734375,1, coat,True,EleutherAI/pythia-70m,16000,70426624
"Kristen put her spring jacket on, but she changed into her winter coat after she felt how cold it was.",coat,dominant,no,no,2.0843582153320312,2.0843582153320312,2.0843582153320312,5.647135257720947,2.1694064140319824,1, coat,True,EleutherAI/pythia-70m,16000,70426624
"Cal hoped to see the moon and stars with his telescope, but he couldn't see the stars because of the city lights.",stars,dominant,yes,yes,1.9310201406478882,1.9310201406478882,1.9310201406478882,4.4854631423950195,1.6958627700805664,1, stars,True,EleutherAI/pythia-70m,16000,70426624
"Cal hoped to see something with his telescope, but he couldn't see the stars because of the city lights.",stars,dominant,no,yes,4.066327095031738,4.066327095031738,4.066327095031738,5.326216697692871,1.6341817378997803,1, stars,True,EleutherAI/pythia-70m,16000,70426624
"Joyce's breakfast was supposed to come with toast, but she substituted potatoes for the toast because of her diet.",toast,dominant,yes,no,3.5616230964660645,3.5616230964660645,3.5616230964660645,4.804609298706055,2.2298007011413574,1, toast,True,EleutherAI/pythia-70m,16000,70426624
"Joyce's breakfast was supposed to come with bread, but she substituted potatoes for the toast because of her diet.",toast,dominant,no,no,5.458046913146973,5.458046913146973,5.458046913146973,4.898653984069824,2.082683563232422,1, toast,True,EleutherAI/pythia-70m,16000,70426624
"Roger rewired the light and changed the bulb, but it still didn't turn on because the bulb he used was wrong.",bulb,dominant,yes,no,3.3730194568634033,3.3730194568634033,3.3730194568634033,7.860951900482178,3.1017374992370605,1, bulb,True,EleutherAI/pythia-70m,16000,70426624
"Roger rewired the light, but it still didn't turn on because the bulb he used was wrong.",bulb,dominant,no,no,8.638276100158691,8.638276100158691,8.638276100158691,6.699927806854248,3.255855083465576,1, bulb,True,EleutherAI/pythia-70m,16000,70426624
"Although the managers and staff were worried about potential job cuts, it turned out that none of the staff were let go.",staff,dominant,yes,no,2.8932487964630127,2.8932487964630127,2.8932487964630127,2.1718602180480957,9.523368835449219,1, staff,True,EleutherAI/pythia-70m,16000,70426624
"Although the managers were worried about potential job cuts, it turned out that none of the staff were let go.",staff,dominant,no,no,3.9333856105804443,3.9333856105804443,3.9333856105804443,2.780198335647583,9.283350944519043,1, staff,True,EleutherAI/pythia-70m,16000,70426624
The patio had one very comfortable chair that Christa wanted because the only other chair was old and broken.,chair,dominant,yes,no,3.610100746154785,3.610100746154785,3.610100746154785,2.2814254760742188,7.321139812469482,1, chair,True,EleutherAI/pythia-70m,16000,70426624
The patio had one very comfortable seat that Christa wanted because the only other chair was old and broken.,chair,dominant,no,no,6.046110153198242,6.046110153198242,6.046110153198242,2.0464038848876953,7.514731407165527,1, chair,True,EleutherAI/pythia-70m,16000,70426624
