sentence,homophone,condition,repeated,plural,target_token_surprisal,target_span_surprisal_sum,target_span_surprisal_mean,spillover_1_surprisal,spillover_2_surprisal,n_target_tokens,target_token_str,match_found,model,checkpoint,n_params
"Scott was a wrestler and a boxer when he was young, but being a boxer gave him arthritis.",boxer,dominant,yes,no,11.795626640319824,23.027226448059082,11.513613224029541,11.678770065307617,10.289314270019531,2, boxer,True,EleutherAI/pythia-70m,32,70426624
"Scott was a wrestler and a fighter when he was young, but being a boxer gave him arthritis.",boxer,dominant,no,no,11.7912015914917,22.98745822906494,11.49372911453247,11.67155933380127,10.267599105834961,2, boxer,True,EleutherAI/pythia-70m,32,70426624
"The builder was supposed to put in the new kitchen counter and cabinets, but the selected cabinet style was sold out.",cabinet,dominant,yes,yes,10.022967338562012,10.022967338562012,10.022967338562012,10.717890739440918,9.855901718139648,1, cabinet,True,EleutherAI/pythia-70m,32,70426624
"The builder was supposed to put in the new kitchen, but the selected cabinet style was sold out.",cabinet,dominant,no,yes,10.027698516845703,10.027698516845703,10.027698516845703,10.76921272277832,9.856422424316406,1, cabinet,True,EleutherAI/pythia-70m,32,70426624
"Mark's favorite band was playing in his town, but back stage passes to meet the band members were sold out.",band,dominant,yes,no,9.680234909057617,9.680234909057617,9.680234909057617,10.520269393920898,10.835859298706055,1, band,True,EleutherAI/pythia-70m,32,70426624
"Mark's favorite music group was playing in his town, but back stage passes to meet the band members were sold out.",band,dominant,no,no,9.735544204711914,9.735544204711914,9.735544204711914,10.51273250579834,10.834449768066406,1, band,True,EleutherAI/pythia-70m,32,70426624
"Maddy always paid attention and took notes, but when she was sick she had to get a copy of the notes from her friend.",notes,dominant,yes,yes,10.927278518676758,10.927278518676758,10.927278518676758,11.305252075195312,10.153873443603516,1, notes,True,EleutherAI/pythia-70m,32,70426624
"Maddy always paid attention and took notes, but when she was sick she had to get a copy of the notes from her friend.",notes,dominant,no,yes,10.927278518676758,10.927278518676758,10.927278518676758,11.305252075195312,10.153873443603516,1, notes,True,EleutherAI/pythia-70m,32,70426624
"Marge was responsible for finding a graduation speaker, so when the speaker canceled last minute she was fired.",speaker,dominant,yes,no,11.094732284545898,11.094732284545898,11.094732284545898,10.736404418945312,11.344051361083984,1, speaker,True,EleutherAI/pythia-70m,32,70426624
"Marge was responsible for organizing the graduation ceremony, so when the speaker canceled last minute she was fired.",speaker,dominant,no,no,11.104253768920898,11.104253768920898,11.104253768920898,10.7586669921875,11.240842819213867,1, speaker,True,EleutherAI/pythia-70m,32,70426624
"For class the kids had to write a poem or a legend, but everyone wrote a legend because it was easier.",legend,dominant,yes,no,10.429758071899414,10.429758071899414,10.429758071899414,10.277307510375977,10.688365936279297,1, legend,True,EleutherAI/pythia-70m,32,70426624
For class the kids had to write some kind of tall-tale; everyone wrote a legend because it was easier.,legend,dominant,no,no,10.517066955566406,10.517066955566406,10.517066955566406,10.276298522949219,10.661052703857422,1, legend,True,EleutherAI/pythia-70m,32,70426624
"At night Sue's mom reads her a story before bed, but last night they didn't read a story since she was in trouble.",story,dominant,yes,no,10.349987983703613,10.349987983703613,10.349987983703613,10.693702697753906,9.734524726867676,1, story,True,EleutherAI/pythia-70m,32,70426624
"At night Sue's mom reads her a book before bed, but last night they didn't read a story since she was in trouble.",story,dominant,no,no,10.279558181762695,10.279558181762695,10.279558181762695,10.653213500976562,9.714213371276855,1, story,True,EleutherAI/pythia-70m,32,70426624
"The students forgot to water the flowers and plant, so when they returned from break the plant was dead.",plant,dominant,yes,no,11.538537979125977,11.538537979125977,11.538537979125977,9.4404296875,10.498054504394531,1, plant,True,EleutherAI/pythia-70m,32,70426624
"The students forgot to take care of the garden, so when they returned from break the plant was dead.",plant,dominant,no,no,11.543737411499023,11.543737411499023,11.543737411499023,9.475886344909668,10.52687931060791,1, plant,True,EleutherAI/pythia-70m,32,70426624
"The farmer grew potatoes and corn, but he only sold his corn at the local market.",corn,dominant,yes,no,11.364238739013672,11.364238739013672,11.364238739013672,9.614411354064941,5.905206203460693,1, corn,True,EleutherAI/pythia-70m,32,70426624
"The farmer grew many crops, but he only sold his corn at the local market.",corn,dominant,no,no,11.238615989685059,11.238615989685059,11.238615989685059,9.66470718383789,6.01451301574707,1, corn,True,EleutherAI/pythia-70m,32,70426624
Addictions and bad habits are hard to overcome because people often don't even realize what bad habit they have.,habit,dominant,yes,no,11.60263729095459,11.60263729095459,11.60263729095459,11.394657135009766,9.346009254455566,1, habit,True,EleutherAI/pythia-70m,32,70426624
Addictions and bad traits are hard to overcome because people often don't even realize what bad habit they have.,habit,dominant,no,no,11.626953125,11.626953125,11.626953125,11.380868911743164,9.280097961425781,1, habit,True,EleutherAI/pythia-70m,32,70426624
"The costume looked good with a tiara or crown, but Pam bought a crown because it was really cheap.",crown,dominant,yes,no,11.147397994995117,11.147397994995117,11.147397994995117,9.951709747314453,10.79690170288086,1, crown,True,EleutherAI/pythia-70m,32,70426624
"The costume looked good with a tiara, but Pam bought a crown because it was really cheap.",crown,dominant,no,no,11.160238265991211,11.160238265991211,11.160238265991211,9.978443145751953,10.76434326171875,1, crown,True,EleutherAI/pythia-70m,32,70426624
"The saleswoman recommended that Gabe try a different suit, but he liked the suit he had on too much to listen.",suit,dominant,yes,no,11.398466110229492,11.398466110229492,11.398466110229492,10.867147445678711,11.383689880371094,1, suit,True,EleutherAI/pythia-70m,32,70426624
"The saleswoman recommended that Gabe try something different, but he liked the suit he had on too much to listen.",suit,dominant,no,no,11.35896110534668,11.35896110534668,11.35896110534668,10.908543586730957,11.366300582885742,1, suit,True,EleutherAI/pythia-70m,32,70426624
"Kristen put her spring coat on, but she changed into her winter coat after she felt how cold it was.",coat,dominant,yes,no,10.494311332702637,10.494311332702637,10.494311332702637,10.483865737915039,9.772933006286621,1, coat,True,EleutherAI/pythia-70m,32,70426624
"Kristen put her spring jacket on, but she changed into her winter coat after she felt how cold it was.",coat,dominant,no,no,10.536764144897461,10.536764144897461,10.536764144897461,10.558513641357422,9.714078903198242,1, coat,True,EleutherAI/pythia-70m,32,70426624
"Cal hoped to see the moon and stars with his telescope, but he couldn't see the stars because of the city lights.",stars,dominant,yes,yes,10.417038917541504,10.417038917541504,10.417038917541504,9.835756301879883,8.491680145263672,1, stars,True,EleutherAI/pythia-70m,32,70426624
"Cal hoped to see something with his telescope, but he couldn't see the stars because of the city lights.",stars,dominant,no,yes,10.359271049499512,10.359271049499512,10.359271049499512,9.835067749023438,8.392934799194336,1, stars,True,EleutherAI/pythia-70m,32,70426624
"Joyce's breakfast was supposed to come with toast, but she substituted potatoes for the toast because of her diet.",toast,dominant,yes,no,11.256843566894531,11.256843566894531,11.256843566894531,9.8826265335083,8.511152267456055,1, toast,True,EleutherAI/pythia-70m,32,70426624
"Joyce's breakfast was supposed to come with bread, but she substituted potatoes for the toast because of her diet.",toast,dominant,no,no,11.231029510498047,11.231029510498047,11.231029510498047,9.917505264282227,8.509136199951172,1, toast,True,EleutherAI/pythia-70m,32,70426624
"Roger rewired the light and changed the bulb, but it still didn't turn on because the bulb he used was wrong.",bulb,dominant,yes,no,10.85284423828125,10.85284423828125,10.85284423828125,10.98165512084961,11.752947807312012,1, bulb,True,EleutherAI/pythia-70m,32,70426624
"Roger rewired the light, but it still didn't turn on because the bulb he used was wrong.",bulb,dominant,no,no,10.923341751098633,10.923341751098633,10.923341751098633,10.992093086242676,11.742586135864258,1, bulb,True,EleutherAI/pythia-70m,32,70426624
"Although the managers and staff were worried about potential job cuts, it turned out that none of the staff were let go.",staff,dominant,yes,no,11.231346130371094,11.231346130371094,11.231346130371094,11.389056205749512,11.822900772094727,1, staff,True,EleutherAI/pythia-70m,32,70426624
"Although the managers were worried about potential job cuts, it turned out that none of the staff were let go.",staff,dominant,no,no,11.19267463684082,11.19267463684082,11.19267463684082,11.417988777160645,11.805758476257324,1, staff,True,EleutherAI/pythia-70m,32,70426624
The patio had one very comfortable chair that Christa wanted because the only other chair was old and broken.,chair,dominant,yes,no,10.563230514526367,10.563230514526367,10.563230514526367,9.959245681762695,11.245645523071289,1, chair,True,EleutherAI/pythia-70m,32,70426624
The patio had one very comfortable seat that Christa wanted because the only other chair was old and broken.,chair,dominant,no,no,10.504301071166992,10.504301071166992,10.504301071166992,9.987751960754395,11.242602348327637,1, chair,True,EleutherAI/pythia-70m,32,70426624
